{
 "standard": "atelier-block/0.1",
 "name": "zenedgex.cim_macro",
 "version": "1.0.0",
 "owner": "ZenEdgeX",
 "slot_class": "compute.matmul_tile",
 "top": "cim_macro",
 "description": "Digital in-memory compute: SRAM compute memory holding the weights, a tile register and adder trees, in standard cells.",
 "parameters": {
  "R": {
   "values": [
    16,
    32,
    64,
    128
   ],
   "meaning": "reduction length of a tile (weight rows)"
  },
  "C": {
   "values": [
    8,
    16,
    32,
    64
   ],
   "meaning": "output columns"
  },
  "DW": {
   "values": [
    8
   ],
   "meaning": "signed operand width"
  },
  "IB": {
   "values": [
    1,
    2,
    4,
    8
   ],
   "meaning": "input bits applied per cycle; divides DW"
  },
  "DEPTH": {
   "rule": "a multiple of R",
   "meaning": "weight rows held"
  },
  "AW": {
   "rule": "2*DW + clog2(R)",
   "meaning": "result width (derived)"
  },
  "TILE_LAT": {
   "rule": ">= 1",
   "meaning": "cycles from tile_req to the first accepted row"
  },
  "SB": {
   "rule": "clog2(DEPTH/R)",
   "meaning": "slot address bits (derived)"
  }
 },
 "port_groups": [
  {
   "name": "clk_rst",
   "protocol": "clock_reset",
   "ports": {
    "clk": "clk",
    "rst_n": "rst_n"
   }
  },
  {
   "name": "wr",
   "protocol": "write_vr",
   "role": "sink",
   "ports": {
    "valid": "wr_valid",
    "ready": "wr_ready",
    "addr": "wr_addr",
    "data": "wr_data"
   }
  },
  {
   "name": "tile",
   "protocol": "tile_req_hold",
   "ports": {
    "req": "tile_req",
    "slot": "slot",
    "hold": "hold"
   }
  },
  {
   "name": "x",
   "protocol": "stream_v",
   "role": "sink",
   "ports": {
    "valid": "x_valid",
    "data": "x_row"
   }
  },
  {
   "name": "y",
   "protocol": "stream_v",
   "role": "source",
   "ports": {
    "valid": "y_valid",
    "data": "y_row"
   }
  }
 ],
 "capabilities": [
  {
   "op": "matmul_tile",
   "a": "int8",
   "w": "int8",
   "acc": "int(2*DW+clog2(R))",
   "reference": "generator/isa.py COMPUTE"
  }
 ],
 "files": {
  "rtl": [
   "rtl/cim_macro.sv",
   "rtl/dimc_mem.sv",
   "rtl/gemm_dimc.sv",
   "rtl/sram.sv"
  ]
 }
}
